{
  "name": "projects",
  "columns": [
    {
      "name": "id",
      "datatype": "uuid",
      "nullable": false
    },
    {
      "name": "name",
      "datatype": "text",
      "nullable": false
    },
    {
      "name": "description",
      "datatype": "text",
      "nullable": true
    }
  ],
  "primary-key": [
    "id"
  ],
  "comment": "Projects - a project owns its documents"
}
