{
  "name": "tags",
  "columns": [
    {
      "name": "id",
      "datatype": "integer",
      "nullable": false,
      "primarykey": true,
      "generate": "always"
    },
    {
      "name": "document_id",
      "datatype": "uuid",
      "nullable": false
    },
    {
      "name": "label",
      "datatype": "text",
      "nullable": false
    }
  ],
  "foreign-keys": [
    {
      "name": "tags_document_fk",
      "columns": [
        "document_id"
      ],
      "reference": {
        "table": "documents",
        "columns": [
          "id"
        ]
      }
    }
  ],
  "comment": "Labels on documents"
}
